{"$schema":"http://json-schema.org/draft-07/schema#","title":"source-snapshot.v1","type":"object","additionalProperties":false,"required":["schema","repo_identity","source_commit","source_tree","derived_at","deriver","open_set"],"properties":{"schema":{"const":"source-snapshot.v1"},"repo_identity":{"type":"string","pattern":"^[A-Za-z0-9_.-]+/[A-Za-z0-9_.-]+$"},"source_commit":{"type":"string","pattern":"^[0-9a-f]{40}$"},"source_tree":{"type":"string","pattern":"^[0-9a-f]{40}$"},"derived_at":{"type":"string","pattern":"^\\d{4}-\\d{2}-\\d{2}T[^ ]+Z$","format":"date-time"},"deriver":{"type":"object","additionalProperties":false,"required":["tool","ref"],"properties":{"tool":{"type":"string"},"ref":{"type":"string"}}},"open_set":{"type":"array","items":{"type":"object","additionalProperties":false,"required":["gid","deps","deps_all_closed"],"properties":{"gid":{"type":"string"},"deps":{"type":"array","items":{"type":"string"}},"deps_all_closed":{"type":"boolean"}}}}}}
